{
  "colors": {
    "primary": "#8B5CF6",
    "secondary": "#1E1B4B",
    "accent": "#06B6D4",
    "background": "#0F0E1A",
    "foreground": "#F8FAFC",
    "muted": "#94A3B8",
    "border": "#334155"
  },
  "typography": {
    "fontFamily": {
      "sans": "'Inter', system-ui, -apple-system, sans-serif",
      "heading": "'Orbitron', 'Inter', sans-serif"
    },
    "fontSize": {
      "base": "16px",
      "heading": "1.25"
    }
  },
  "borderRadius": {
    "small": "0.25rem",
    "default": "0.75rem",
    "large": "1rem",
    "full": "9999px"
  },
  "shadows": {
    "small": "0 1px 2px rgba(139, 92, 246, 0.1)",
    "default": "0 4px 6px rgba(139, 92, 246, 0.15)",
    "large": "0 10px 25px rgba(139, 92, 246, 0.25)"
  }
}
