{
  "colors": {
    "primary": "#0066CC",
    "secondary": "#003D7A",
    "accent": "#00A3E0",
    "background": "#F8FAFC",
    "foreground": "#0F172A",
    "muted": "#64748B",
    "border": "#E2E8F0"
  },
  "typography": {
    "fontFamily": {
      "sans": "'Inter', system-ui, -apple-system, sans-serif",
      "heading": "'Inter', system-ui, -apple-system, sans-serif"
    },
    "fontSize": {
      "base": "16px",
      "heading": "1.2"
    }
  },
  "borderRadius": {
    "small": "0.375rem",
    "default": "0.5rem",
    "large": "0.75rem",
    "full": "9999px"
  },
  "shadows": {
    "small": "0 1px 2px rgba(15, 23, 42, 0.05)",
    "default": "0 4px 6px rgba(15, 23, 42, 0.1)",
    "large": "0 10px 25px rgba(15, 23, 42, 0.15)"
  }
}
