{
  "colors": {
    "primary": "#F59E0B",
    "secondary": "#92400E",
    "accent": "#FCD34D",
    "background": "#FFFBEB",
    "foreground": "#451A03",
    "muted": "#78716C",
    "border": "#FDE68A"
  },
  "typography": {
    "fontFamily": {
      "sans": "'Nunito', system-ui, -apple-system, sans-serif",
      "heading": "'Fraunces', Georgia, serif"
    },
    "fontSize": {
      "base": "16px",
      "heading": "1.3"
    }
  },
  "borderRadius": {
    "small": "0.5rem",
    "default": "0.75rem",
    "large": "1.5rem",
    "full": "9999px"
  },
  "shadows": {
    "small": "0 1px 3px rgba(69, 26, 3, 0.08)",
    "default": "0 4px 8px rgba(69, 26, 3, 0.12)",
    "large": "0 12px 30px rgba(69, 26, 3, 0.18)"
  }
}
